<?xml version="1.0" encoding="UTF-8" ?>
<libreria xmlns:xsi="http://www.w3.org/2001/XMLSchema-instance" xsi:noNamespaceSchemaLocation="Ejercicio6.xsd">
    <codigo>1263</codigo>
    <direccion>Juan de Juni, 31</direccion>
    <telefono>983555555</telefono>
    <propietario>
        <nombre>Juanito</nombre>
        <telefono>656222111</telefono>
    </propietario>
    <libro>
        <titulo>Cien años de soledad</titulo>
        <autor>Gabriel García Márquez</autor>
        <formato>Rústica</formato>
        <publicacion>1967</publicacion>
        <precio>23.5</precio>
    </libro>
</libreria>